{
  "schema": "RAFAELIA_GAP_PRIORITY_CONTRACT_V1",
  "ledger_id": "GAP-LEDGER-PERFORMANCE-METRIC-20260814-V1",
  "created_at": "2026-08-14T02:10:00-03:00",
  "scope": "Performance Metric Observatory / Vectras benchmark recovery / MetricObservationV1 / historical conversation shards / CI execution receipts",
  "invariants": [
    "IDEA != IMPLEMENTATION != EXECUTION != EVIDENCE != CLAIM",
    "MEMORY != PROOF",
    "INDEX != CONTENT",
    "NUMBER_FOUND != MEASUREMENT != REPRODUCIBLE_MEASUREMENT != GENERAL_CLAIM",
    "TOKEN_VAZIO is preserved and auditable; it is never silently filled",
    "APPEND_ONLY: historical and conflicting states are not overwritten",
    "claim_allowed=false until the applicable evidence contract is satisfied",
    "negative evidence closes only the proposition actually tested",
    "urgency and importance do not authorize evidence promotion"
  ],
  "priority_model": {
    "scalar_score_forbidden": true,
    "priority_classes": ["P0", "P1", "P2", "P3"],
    "vector_dimensions": [
      "urgency",
      "importance",
      "uncertainty",
      "provenance_completeness",
      "evidence_strength",
      "dependency_centrality",
      "closure_verifiability",
      "regression_risk"
    ]
  },
  "gaps": [
    {
      "gap_id": "GAP-PMO-001",
      "title": "Recover current-access content identity and bytes for conversations-048/049/050",
      "status": "PARTIAL",
      "priority": "P0",
      "token_state": "TOKEN_VAZIO_RAW_CONTENT_048_049_050_CURRENT_ACCESS",
      "why_it_matters": "The export manifest proves that the three shards exist and fixes their ordinals, sizes and parent lineage, but the manifest source_id is not the individual Drive file ID. Treating manifest identity as raw-shard identity would corrupt provenance and can contaminate every downstream historical metric extraction.",
      "vector": {
        "urgency": "HIGH",
        "importance": "CRITICAL",
        "uncertainty": "MEDIUM",
        "provenance_completeness": "PARTIAL",
        "evidence_strength": "OBSERVED",
        "dependency_centrality": "HIGH",
        "closure_verifiability": "HIGH",
        "regression_risk": "HIGH"
      },
      "contribution_vector": [
        {"target": "PROVENANCE", "direction": "INCREASE", "mechanism": "Bind each shard to its real provider object instead of inheriting export_manifest identity."},
        {"target": "TRACEABILITY", "direction": "INCREASE", "mechanism": "Permit message-level metrics to point back to exact shard bytes."},
        {"target": "UNCERTAINTY", "direction": "REDUCE", "mechanism": "Replace current-access ambiguity with verified file identity plus hash."},
        {"target": "ANTI_REGRESSION", "direction": "INCREASE", "mechanism": "Prevent later extraction code from collapsing manifest lineage and raw-object lineage."}
      ],
      "provenance_refs": [
        {"kind": "DRIVE_FILE", "id": "13xMqjbn1O5nc1Q3gC3ZjnUdLLW5qneWk", "locator": "export_manifest.json", "sha256": "38bb97724a432420328a322eb27ff1af9de28201c2857448e62d2b2e3a36df4a"},
        {"kind": "DRIVE_FOLDER", "id": "1P7hJq5R4fgYGEQIVNgRvllAad2lGxWEv", "locator": "NOVOexport parent lineage", "sha256": null},
        {"kind": "MANIFEST_ENTRY", "id": "ordinal-72", "locator": "conversations-048.json; size_bytes=36771626", "sha256": null},
        {"kind": "MANIFEST_ENTRY", "id": "ordinal-73", "locator": "conversations-049.json; size_bytes=47806754", "sha256": null},
        {"kind": "MANIFEST_ENTRY", "id": "ordinal-74", "locator": "conversations-050.json; size_bytes=17115060", "sha256": null}
      ],
      "closure_contract": {
        "closure_condition": "All three shards have independently verified provider object IDs or an equivalent exact byte-access route, with bytes/hash and manifest lineage joined without identity substitution.",
        "required_evidence": [
          "Exact provider identity or byte-access locator for conversations-048.json",
          "Exact provider identity or byte-access locator for conversations-049.json",
          "Exact provider identity or byte-access locator for conversations-050.json",
          "SHA-256 or equivalent immutable content digest for each recovered shard",
          "Receipt proving name/size/parent/bytes relation"
        ],
        "forbidden_promotion": "Do not label any metric extracted from 048-050 as raw-bound or reproducible while the exact shard bytes/object identity remain unresolved.",
        "providencia": "Continue through derived MESSAGES/NODES and Drive parent pagination/search until exact objects or equivalent byte-level derivatives are located; preserve negative search receipts.",
        "next_verifiable_step": "Resolve one of 048/049/050 to an exact provider object or exact derived byte span and record its hash before scaling to the other two."
      },
      "claim_allowed": false
    },
    {
      "gap_id": "GAP-PMO-002",
      "title": "Recover a raw VectraBenchmark 79-slot execution export",
      "status": "OPEN",
      "priority": "P0",
      "token_state": "TOKEN_VAZIO_VECTRA_79_RAW_EXECUTION",
      "why_it_matters": "The 79-slot binding and unit semantics can only become an executed measurement surface when a real CSV/JSONL/runtime export is attached to a device/build/workload context. Code capability and historical prose cannot substitute for this receipt.",
      "vector": {
        "urgency": "CRITICAL",
        "importance": "CRITICAL",
        "uncertainty": "HIGH",
        "provenance_completeness": "LOW",
        "evidence_strength": "DOCUMENTED",
        "dependency_centrality": "CRITICAL",
        "closure_verifiability": "HIGH",
        "regression_risk": "CRITICAL"
      },
      "contribution_vector": [
        {"target": "EVIDENCE_DENSITY", "direction": "INCREASE", "mechanism": "One complete 79-slot raw run can bind many currently unbound quantitative families at once."},
        {"target": "REPRODUCIBILITY", "direction": "INCREASE", "mechanism": "Raw export plus environment permits rerun comparison rather than narrative comparison."},
        {"target": "SEMANTIC_ALIGNMENT", "direction": "INCREASE", "mechanism": "Metric IDs, formatted units and semantic kinds remain joined at source."},
        {"target": "OPERATIONAL_LEVERAGE", "direction": "INCREASE", "mechanism": "A single governed run advances many downstream benchmark questions simultaneously."}
      ],
      "provenance_refs": [
        {"kind": "GITHUB_PR", "id": "rafaelmeloreisnovo/Mapa#235", "locator": "MetricObservationV1 stacked implementation", "sha256": null},
        {"kind": "DRIVE_FILE", "id": "1ClcleKaG8Uam7NA4l1FF8x7A0YiFyQQwGMIRkAr-_-M", "locator": "RAFAELIA Performance Metric Observatory V1", "sha256": null}
      ],
      "closure_contract": {
        "closure_condition": "At least one unmodified VectraBenchmark raw output containing metric identifiers/values/units is preserved with device, build, workload, timestamp and source revision information sufficient for deterministic ingestion.",
        "required_evidence": [
          "Raw CSV/JSONL/runtime output",
          "Source revision or APK/build identity",
          "Device/ABI/OS context",
          "Workload/configuration context",
          "Raw file hash",
          "Ingestion receipt showing accepted/rejected records without silent coercion"
        ],
        "forbidden_promotion": "Do not promote documented targets, estimates, UI formatter outputs or historical prose to MEASURED_WITH_RECEIPT.",
        "providencia": "Search Drive, conversation derivatives, GitHub artifacts and owned-device exports for exact benchmark payloads before scheduling unnecessary reruns.",
        "next_verifiable_step": "Locate one raw VectraBenchmark output and run the governed ingestor against it while preserving the original bytes."
      },
      "claim_allowed": false
    },
    {
      "gap_id": "GAP-PMO-003",
      "title": "Join historical metric observations to exact device/build/workload/run identity",
      "status": "PARTIAL",
      "priority": "P0",
      "token_state": "TOKEN_VAZIO_HISTORICAL_RUN_CONTEXT_JOIN",
      "why_it_matters": "Twenty historical quantitative observations have been materialized, but without a complete same-run context join a number can be genuine historical evidence while still being unsafe for cross-run or hardware comparison.",
      "vector": {
        "urgency": "HIGH",
        "importance": "CRITICAL",
        "uncertainty": "HIGH",
        "provenance_completeness": "PARTIAL",
        "evidence_strength": "OBSERVED",
        "dependency_centrality": "HIGH",
        "closure_verifiability": "MEDIUM",
        "regression_risk": "CRITICAL"
      },
      "contribution_vector": [
        {"target": "TRACEABILITY", "direction": "INCREASE", "mechanism": "Join each observation to a run identity rather than only its surrounding narrative."},
        {"target": "UNCERTAINTY", "direction": "REDUCE", "mechanism": "Separate same-run values from later corrections, estimates and unrelated device results."},
        {"target": "ANTI_REGRESSION", "direction": "INCREASE", "mechanism": "Supersession stays explicit instead of replacing older historical values."},
        {"target": "CONTRACT_STRENGTH", "direction": "INCREASE", "mechanism": "Comparison is allowed only after context-equivalence fields are proven or explicitly marked different."}
      ],
      "provenance_refs": [
        {"kind": "CONVERSATION_SHARD", "id": "conversations-046.json", "locator": "historical quantitative source family", "sha256": null},
        {"kind": "CONVERSATION_SHARD", "id": "conversations-047.json", "locator": "historical quantitative source family", "sha256": null},
        {"kind": "GITHUB_PR", "id": "rafaelmeloreisnovo/Mapa#235", "locator": "materialized historical observations", "sha256": null}
      ],
      "closure_contract": {